q_id,config,subset,target_chapter,answer_text,hedged,context_chars
1,H,summarisation,2,"Chapter 2 of the Python Tutorial is titled ""Using the Python Interpreter."" This chapter focuses on invoking, configuring, and interacting with the Python interpreter on various operating systems. It covers starting the interpreter from the command line, setting up the system path, exiting the interpreter, and using its line-editing features. The chapter also explains how to execute scripts and modules, pass arguments, and handle interactive mode. Additionally, it discusses source code encoding declarations for non-UTF-8 files. After reading this chapter, readers will be able to start the Python interpreter, run scripts and modules, and configure its environment according to their needs.",0,6626
1,N,summarisation,2,"Chapter Two of the Python Tutorial is about Using the Python Interpreter. It teaches readers how to effectively utilize the Python interpreter, a fundamental tool in Python programming. The chapter covers executing Python code interactively, understanding basic data types and variables, performing arithmetic operations, and handling user input. Prerequisites include familiarity with basic computer concepts and an installed Python environment. Upon completion, readers will be able to write, run, and debug simple Python scripts directly from the interpreter.",0,6879
2,H,summarisation,3,"The ""An Informal Introduction to Python"" chapter, as per your question, teaches basic Python concepts and operations. It introduces readers to using Python as a calculator, covering arithmetic calculations, variables assignment, string manipulation, support for floating point numbers, comments, and the use of the ** operator for powers [chunk 1 §synopsis p.15-155]. It also covers creating and modifying variables, concatenating strings, indexing and slicing strings and lists, and Python's support for comments and the use of the ** operator for powers [chunk 1 §synopsis p.15-155]. However, it does not cover advanced concepts like exceptions and user-defined classes, which are covered in later chapters [chunk 2 p.10].",1,5737
2,N,summarisation,3,"The ""Informal Introduction"" chapter (Chapter Three) teaches an introduction to the Python programming language, explaining its syntax and basic usage. It covers how to write and run Python scripts, understand comments in Python code, and differentiate between input and output during execution. No prerequisites are required, but familiarity with programming concepts may aid comprehension. After reading this chapter, readers will be able to write simple Python programs, including using comments for clarity in their code. [chunk 1 §synopsis p.15]",0,5242
3,H,summarisation,4,"Chapter 4 of the Python Tutorial introduces additional control flow tools, including if statements, for statements, the range() function, break and continue statements, pass statements, defining functions, lambda functions, documentation strings, and more on defining functions.",0,9249
3,N,summarisation,4,"Chapter 4 of the Python Tutorial introduces more control flow tools, expanding upon the introduction of the while statement. It covers if-else statements, for loops, and nested loops, each with unique Python-specific characteristics [chunk 3 §synopsis p.25].",0,9092
4,H,summarisation,5,"The Data Structures chapter (Chapter Five) covers the following topics:

1. More on Lists [chunk 3 §section p.31]
2. The del statement [chunk 3 §section p.35]
3. Tuples and Sequences [chunk 6 §section p.42]
4. Sets [chunk 4 §section p.37]
5. Dictionaries [chunk 4 §section p.38]
6. Looping Techniques [chunk 4 §section p.39]
7. More on Conditions [chunk 4 §section p.40]
8. Comparing Sequences and Other Types [chunk 4 §section p.40]",0,6586
4,N,summarisation,5,"The Data Structures chapter (Chapter Five) covers the creation, manipulation, and optimization of various data structures such as arrays, linked lists, stacks, queues, trees, and hash tables [chunk 1 §synopsis p.37]. It also delves deeper into previously learned concepts about lists, tuples, sequences, sets, dictionaries, looping techniques, conditions, comparing sequences, and other types [chunk 4 §section p.3]. However, it does not explicitly mention the array module or deque from the collections module, which are discussed in other chapters of the document.",1,6501
5,H,summarisation,6,"The Modules chapter of the Python Tutorial (Chapter Six) teaches how to create and use Python scripts and modules, as well as importing them for reuse in other programs. To write longer programs, it is recommended to use a text editor to prepare the input for the interpreter and run it with that file as input instead of repeatedly entering commands in the Python interpreter.

To create a module, you need to write Python definitions and statements in a .py file, which serves as the module's name. The module can contain functions, variables, and executable statements. When importing a module, its definitions are not directly entered into the current symbol table; instead, only the module name is added.

The chapter provides an example of creating a Fibonacci numbers module (fibo.py) with two functions: fib(n) and fib2(n). After importing the module using the command `import fibo`, you can access its functions by calling `fibo.fib(1000)` or `fibo.fib2(100)`.

The chapter also covers advanced topics such as executable statements in modules, modifying the module search path, and importing all names from a module. It is essential to understand these concepts when working with larger projects and organizing code for easier maintenance.",0,8905
5,N,summarisation,6,"The Modules chapter of the Python Tutorial (Chapter Six) teaches readers how to create and utilize Python scripts and modules for organizing longer programs, facilitating easier maintenance, and reusing functions across multiple programs. It explains how to define and import modules in Python, which are files containing Python definitions and statements with the suffix .py. The chapter also covers assigning a function from a module to a local name for easier use. After reading this chapter, readers will be able to create their own modules, import them into scripts or interactive instances of the interpreter, and access functions defined in those modules. Additional resources for further exploration of Python can be found in the Library Reference, installing-index, reference-index, and other Python documentation and websites mentioned in the context excerpts provided.",0,6252
6,H,summarisation,7,"Chapter 7 (Input and Output) covers various methods for formatting output in Python, providing more control over the appearance of program results. It discusses formatted string literals (f-strings), the str.format() method, manual string handling, old string formatting using the % operator, reading and writing files, saving structured data with JSON, and more [chunk 2 §synopsis p.59-155]. Additionally, it touches upon topics like error handling in interactive mode [chunk 6 §section p.117] and licensing information for incorporated software [chunk 7 §section p.141-142].",0,6509
6,N,summarisation,7,"Chapter 7 (Input and Output) covers various methods to present a program's output, including displaying data in a user-friendly format and writing it to files for later use. This chapter discusses different output presentation techniques such as fancier output formatting and reading and writing files [chunk 1 §synopsis p.59, chunk 2 §chapter p.59, chunk 4 §section p.3-4].",0,5724
7,H,summarisation,8,"The Errors and Exceptions chapter teaches about exception handling in Python, including:

- Identifying and correcting syntax errors (8.1 Syntax Errors) [chunk 4]
- Understanding and managing exceptions during program execution (8.2 Exceptions) [chunk 9]
- Writing programs that handle selected exceptions (8.3 Handling Exceptions) [chunk 6]
- Raising custom exceptions in their own programs (8.5 User-defined Exceptions) [chunk 10]
- Defining clean-up actions to be executed under all circumstances using the finally clause (8.6 Defining Clean-up Actions) [chunk 1]
- Utilizing the with statement for objects that provide predefined clean-up actions (8.7 Predefined Clean-up Actions) [chunk 1]

The chapter also mentions exceptions can have associated values and exception instances define __str__() so the arguments can be printed directly without having to reference .args [chunk 8]. Additionally, it explains that user-generated interruptions are signaled by raising the KeyboardInterrupt exception [chunk 6].",0,7723
7,N,summarisation,8,"The Errors and Exceptions chapter focuses on understanding and handling errors in a system, specifically syntax errors and exceptions, which are the two primary types of errors that may occur during program execution. It teaches about identifying, troubleshooting, and correcting common error messages encountered while executing examples. The chapter also covers exception handling techniques such as trying to catch exceptions, handling multiple exceptions, and user-defined exceptions [chunk 1 §synopsis p.67].",0,8948
8,H,summarisation,9,"Chapter 9 (Classes) of the Python Tutorial explains how to create and utilize classes in Python for bundling data and functionality together. Key topics include creating new classes, defining attributes and methods, understanding inheritance mechanisms, and redefining built-in operators for class instances. The chapter also covers scopes, namespaces, aliases, iterators, generators, and generator expressions in Python. Prerequisites are a basic understanding of Python programming, but familiarity with Object Oriented Programming (OOP) concepts may be helpful as the chapter provides explanations for OOP features in Python.",0,6954
8,N,summarisation,9,"Chapter 9 (Classes) of the Python Tutorial introduces the concept of classes in Python, a method for bundling data and functionality together. Readers learn how to create new classes, which serve as blueprints for creating new object types. Each class instance can have attributes for maintaining its state and methods (defined by its class) for modifying that state. Python's class mechanism offers standard Object Oriented Programming features such as multiple base classes, method overriding, and the ability for a method to call the method of a base class with the same name. Unlike C++ and Modula-3, built-in types can be used as base classes for user extension. After reading this chapter, readers will be able to create their own classes, modify them at runtime, redefine built-in operators for class instances, and understand the use of objects as classes themselves, providing semantics for importing and renaming.",0,8375
9,H,summarisation,10,"Chapter 10 (Brief Tour of the Standard Library) covers an introduction to essential Python libraries, focusing on modules like os, shutil, glob, sys, re, math, random, statistics, urllib.request, smtplib, datetime, zlib, timeit, doctest, unittest, and various data processing modules. It also includes sections on dates and times, data compression, performance measurement, quality control, and batteries included. The chapter provides an overview of these modules, their functionalities, and how they can be used in Python programming.",0,6309
9,N,summarisation,10,"Chapter 10 (Brief Tour of the Standard Library) provides an overview of the Standard Library, a fundamental component in the programming language. It covers various modules and functions within the library, including string manipulation, file handling, dates and times, data compression, performance measurement, quality control, and more. Prerequisites include basic understanding of the programming language syntax. Upon completion, readers will be able to utilize these tools effectively in their own programs for efficient code execution.

Some specific topics covered in Chapter 10 are:
- Dates and Times (p.85)
- Data Compression (p.86)
- Performance Measurement (p.86)
- Quality Control (p.87)
- Batteries Included (p.87)",0,5173
10,H,summarisation,11,"Chapter 11 (Brief Tour of the Standard Library Part II) covers more advanced modules in Python's Standard Library that support professional programming needs. These modules are typically used for tasks that rarely occur in small scripts. The topics covered include output formatting, templating, working with binary data record layouts, multi-threading, logging, weak references, tools for working with lists, and decimal floating point arithmetic (if chunk 4 is included). However, it's important to note that the context does not explicitly mention all these topics in Chapter 11 synopsis.",1,7561
10,N,summarisation,11,"Chapter 11 (Brief Tour of the Standard Library Part II) covers advanced modules within the Standard Library that are essential for professional programming tasks. These modules are not commonly used in small scripts [chunk 3 §synopsis p.95]. The chapter focuses on topics such as Weak References, Tools for Working with Lists, and Decimal Floating Point Arithmetic [chunk 5 | P:tutorial_edit §section p.4]. Upon completion, readers will be able to utilize these advanced modules effectively in their programming projects [chunk 3 | P:tutorial_edit §synopsis p.95].",0,5221
11,H,summarisation,12,"The Virtual Environments and Packages chapter introduces the use of virtual environments in Python development to manage conflicting package requirements among different applications. It explains how to create a virtual environment using the venv module, activate it, and manage packages with pip for installation, upgrade, and removal. A virtual environment is a self-contained directory tree that includes a specific version of Python and additional packages, allowing multiple applications to use different environments without conflicting requirements. The chapter also covers creating a requirements.txt file to list all necessary packages for an application, which can be installed using pip -r. Prerequisite: Basic understanding of Python and command line navigation.",0,5719
11,N,summarisation,12,"The Virtual Environments and Packages chapter focuses on creating, managing, and utilizing virtual environments for isolating Python projects and their dependencies. It covers installing and configuring popular tools like venv, pipenv, and conda. The chapter includes sections on creating virtual environments, managing packages with pip, and using the requirements.txt file to list installed packages. Prerequisites include a basic understanding of the Python programming language. Upon completion, readers will be able to set up separate working spaces for different projects, ensuring consistent and reproducible results while avoiding conflicts between packages.",0,5631
12,H,summarisation,15,"Chapter 15 teaches about the issues and limitations of floating-point arithmetic in computer hardware. It explains why decimal fractions may not be represented exactly as binary fractions, using examples such as 0.1, and discusses the implications for summation and rounding operations. The chapter also provides tools such as float.as_integer_ratio(), float.hex(), math.fsum(), fractions module, and decimal module to help analyze and mitigate these issues. It further discusses the IEEE-754 floating-point standard and its impact on the precision of floating-point arithmetic in various programming languages. [chunk 1 | P:tutorial_edit §synopsis p.111-155]",0,7484
12,N,summarisation,15,"Chapter 15 of the document discusses floating-point arithmetic, its issues, and limitations. It explains that floating-point numbers are represented as base 2 (binary) fractions in computer hardware, but this representation can lead to potential issues such as rounding errors, underflow, overflow, and loss of precision [chunk 1 §synopsis p.111]. The chapter also mentions the decimal module as a solution for financial applications or other uses that require exact decimal representation [chunk 4 §section p.100].",0,9701
13,H,summarisation,16,"The Appendix chapter in the provided document does not seem to have a specific topic covered explicitly. It appears that it might be used for additional information or appendices like copyright information (Appendix D) [chunk 4], synopsis [chunk 5], glossary [chunk 6], and possibly other resources as well, but the context does not provide enough detail about what is specifically covered in Appendix A and Appendix (not specified).",1,5452
13,N,summarisation,16,"The Appendix chapter does not seem to have a specific content covered in the provided context excerpts. However, there are multiple appendix sections mentioned (Appendix A, Appendix D), but no details about their contents are given.",0,4512
14,H,summarisation,1,"Chapter 1 (Whetting Your Appetite) of the Python Tutorial introduces Python, a versatile programming language suitable for automating various tasks such as search-and-replace over text files, renaming and rearranging photo files, creating custom databases, GUI applications, games, or test suites. It mentions that Python is cross-platform (Windows, Mac OS X, Unix) and offers more structure and support than shell scripts or batch files for large programs, while also providing more error checking than C. The chapter invites readers to play with the Python interpreter as they learn, with subsequent chapters delving into expressions, statements, data types, functions, modules, exceptions, and user-defined classes.",0,6668
14,N,summarisation,1,"Chapter 1 (Whetting Your Appetite) of the Python Tutorial introduces Python, a versatile programming language suitable for automating various tasks such as search-and-replace over text files, renaming and rearranging photo files, creating custom databases, GUI applications, games, or test suites. The chapter encourages readers to play with the Python interpreter as they learn, setting the stage for subsequent chapters that delve into Python's mechanics, features, and advanced concepts. Python is cross-platform (Windows, Mac OS X, Unix), offers more structure and support than shell scripts or batch files for large programs, while also providing more error checking than C. The language allows program splitting into reusable modules, comes with standard modules for file I/O, system calls, sockets, and GUI toolkits like Tk. Python is interpreted, easy to experiment with, and extensible using C if needed. This chapter invites readers to play with the Python interpreter as they learn, preparing them for the subsequent chapters that explain Python's mechanics in detail.",0,8464
15,H,summarisation,13,"Chapter 13 (What Now?) does not provide information about further learning resources directly. However, it mentions that this tutorial is part of Python's documentation set [chunk 5 | P:tutorial_edit §synopsis p.107-155]. The document suggests browsing through the library-index for comprehensive reference material about types, functions, and standard library modules [chunk 5 | P:tutorial_edit §synopsis p.107-155]. Additionally, it recommends visiting Python's major website (www.python.org), accessing Python’s documentation (https://docs.python.org), the Python Package Index (pypi.org), the Python Cookbook (code.activestate.com/recipes/langs/python/), PyVideo (http://www.pyvideo.org), and the Scientific Python project (scipy.org) for further learning resources [chunk 5 | P:tutorial_edit §synopsis p.107-155].",1,7748
15,N,summarisation,13,"Chapter 13 (What Now?) provides several learning resources for further exploration of Python. These resources include the Library Reference for comprehensive information about types, functions, and modules in the standard library [chunk 3 §chapter p.107]. The 'installing-index' explains how to install additional modules written by other Python users [chunk 2 §synopsis p.107-155]. The 'reference-index' offers a detailed explanation of Python’s syntax and semantics [chunk 3 §chapter p.107]. Additional resources include the major Python website (www.python.org), Python’s documentation (docs.python.org), the Python Package Index (pypi.org), the Python Cookbook (code.activestate.com/recipes/langs/python/), PyVideo (www.pyvideo.org), and the Scientific Python project (scipy.org) [chunk 3 §chapter p.107]. For questions or problem reports, you can post to the newsgroup comp.lang.python or send them to the mailing list at python-list@python.org [chunk 2 §synopsis p.107-155].",0,9124
16,H,control,,"To define a function with default arguments in the provided context, you can specify a default value for one or more arguments. This creates a function that can be called with fewer arguments than it is defined to allow. Here's an example from the context:

```python
def ask_ok(prompt, retries=4, reminder='Please try again!'):
    while True:
        ok = input(prompt)
        if ok in ('y', 'ye', 'yes'):
            return True
        if ok in ('n', 'no', 'nop', 'nope'):
            return False
        retries = retries - 1
        if retries < 0:
            raise ValueError('invalid user response')
        print(reminder)
```

In this example, `prompt` is the mandatory argument, and `retries` and `reminder` are optional arguments with default values. The function can be called in several ways as mentioned in the context:

- giving only the mandatory argument: `ask_ok('Do you really want to quit?')`
- giving one of the optional arguments: `ask_ok('OK to overwrite the file?', 2)`
- or even giving all arguments: `ask_ok('OK to overwrite the file?', 2, 'Come on, only yes or no!')`",0,7656
16,N,control,,"To define a function with default arguments, you can specify a default value for one or more arguments. This creates a function that can be called with fewer arguments than it is defined to allow. Here's an example from the context:

```python
def ask_ok(prompt, retries=4, reminder='Please try again!'):
    while True:
        ok = input(prompt)
        if ok in ('y', 'ye', 'yes'):
            return True
        if ok in ('n', 'no', 'nop', 'nope'):
            return False
        retries = retries - 1
        if retries < 0:
            raise ValueError('invalid user response')
        print(reminder)
```

In this example, `prompt` is a required argument, while `retries` and `reminder` are optional arguments with default values. The function can be called in several ways, including giving only the mandatory argument (`ask_ok('Do you really want to quit?')`) or even giving all arguments (`ask_ok('OK to overwrite the file?', 2, 'Come on, only yes or no!')`).",0,12275
17,H,control,,"The syntax for a list comprehension is as follows:

```
[expression for variable in iterable if condition]
```

The expression is evaluated for each element of the iterable (which can be a list, tuple, set, dictionary keys, etc.) in the order they appear. If the expression is a tuple, it must be parenthesized. The optional `if condition` allows filtering elements based on a certain condition.

For example:

```
[x**2 for x in range(10)]  # calculates the squares of numbers from 0 to 9
[x for x in vec if x >= 0]  # filters out negative numbers from the list vec
```",0,8466
17,N,control,,"The syntax for a list comprehension is as follows:

```python
[expression for item in iterable if condition]
```

The expression is evaluated for each item in the iterable, and the result is a new list containing the results. If there's an if condition, it filters the items based on the specified condition. The iterable can be any sequence or iterable object.

For example:

```python
[x*2 for x in range(6)]  # generates [0, 2, 4, 6, 8, 10]
[x for x in range(6) if x % 2 == 0]  # generates [0, 2, 4, 6]
```",0,10587
18,H,control,,"To raise a custom exception in Python, you can create a new exception class that derives from the `Exception` class. Here's an example:

```python
class CustomError(Exception):
    """"""Custom Error for specific conditions""""""
    pass

# Somewhere in your code
try:
    # some operation that might raise CustomError
except CustomError as err:
    print(""An error occurred:"", err)
```

In this example, `CustomError` is a custom exception class. When an operation raises this exception, the except clause catches it and you can handle it accordingly.",0,7563
18,N,control,,"To raise a custom exception in Python, you can create a new exception class that derives from the `Exception` class (either directly or indirectly). Here's an example from the provided context:

```python
class Error(Exception):
    """"""Base class for exceptions in this module.""""""
    pass

class InputError(Error):
    """"""Exception raised for errors in the input.
    Attributes:
        expression -- input expression in which the error occurred
        message -- explanation of the error
    """"""
    def __init__(self, expression, message):
        self.expression = expression
        self.message = message
```

You can then instantiate and raise this custom exception as follows:

```python
try:
    # some code that might fail
except InputError as e:
    print(e.message)
```",0,10498
19,H,control,,"In Python, 'is' is a comparison operator used to check if two variables refer to the same object (memory location). On the other hand, '==' is an equality operator used to compare the values of two variables.

Here are some examples from the context:

- 'is' example: [chunk 3 §section p.46] mentions that 'is' compares whether two objects are really the same object; this only matters for mutable objects like lists.

- '==' example: [chunk 1 §section p.22] explains that the standard comparison operators are written the same as in C, including '==' (equal to).

Also, note that Python does not allow assignment inside expressions, unlike C. This is mentioned in [chunk 5 §section p.46].",0,8808
